Topic	BOW	General Topic
0	vaccine covid flu people get one would like said virus	Vaccine development and distribution
1	mask masks wear wearing wear mask people wearing mask wear masks wearing masks face	Public health measures and restrictions
2	school students schools kids online classes teachers teacher campus semester	professional area of life / job
3	stock stocks market shares price bought company buy sold earnings	financial and economic impact
4	black protests police people white protest blm protesters black people gun	social issues and consequences
5	sars cov sars cov mers vaccine virus sars vaccine vaccine sars sars mers years	Vaccine development and distribution
6	anti vax anti vax vaxxer anti vaxxer vaccine vaxxers vaccines covid anti vaxxers	Anti-vax sentiment and conspiracy theories
7	unemployment economy money stimulus government recession economic jobs people debt	financial and economic impact
8	testing test tests tested positive kits results people get day	Public health measures and restrictions
9	lockdown lockdowns people lock locked would going months go even	Public health measures and restrictions
10	dog vet dogs cat puppy cats pet pup get rabies	personal area of life and leisure
11	gates bill bill gates foundation gates foundation vaccines vaccine microsoft melinda melinda gates	Anti-vax sentiment and conspiracy theories
12	food restaurants restaurant store dining open eat stores vegan go	personal area of life and leisure
13	church god christian religion beast religious bible jesus mark believe	personal area of life and leisure
14	fauci redfield trump anthony fauci anthony dr director aids said infectious	Government policies and decision-making processes
15	wedding married venue 2021 date guests planning weddings get married reception	personal area of life and leisure
16	movie theaters theater movies amc film cinemas release cinema tenet	personal area of life and leisure
17	hydroxychloroquine hcq drug patients chloroquine treatment study azithromycin trump 19	Anti-vax sentiment and conspiracy theories
18	herd herd immunity immunity vaccine population reach herd reach achieve herd would people	Measures against the spread of the virus
19	insurance pay healthcare care health medicare health care paid cost system	Healthcare and hospital systems capacity
20	dr could best tl make original tl dr could make tl bot reduced quot original	None
21	hands wash wash hands touch hand washing gloves sanitizer face clean	Public health measures and restrictions
22	gym gyms training membership going back covid bjj go workout	personal area of life and leisure
23	season football players league fans team game games play player	Personal area of life and leisure
24	quarantine people quarantined reopen reopening 14 going stay quarantining quarantines	Public health measures and restrictions
25	rent property tenants prices month rental house estate housing real estate	financial and economic impact
26	5g towers 5g towers conspiracy gates bill gates covid bill us people	Anti-vax sentiment and conspiracy theories
27	pox chicken pox chicken shingles chickenpox get got vaccine shingles vaccine kid	Healthcare and hospital systems capacity
28	city live lived sf park downtown like place la go	Personal area of life and leisure
29	cuomo twitter reporter 21 ny albany albany based new york york blasio	Government policies and decision-making processes
30	fow fwom aww awe peopwe ouw reeeeeeeeeeeeeee wike hew ow	Anti-vax sentiment and conspiracy theories
31	mrna mrna vaccines mrna vaccine vaccines rna vaccine technology protein years mrna technology	Vaccine development and distribution
32	nz new zealand zealand new australia borders country border cases island	Global health and public health response efforts
33	work home office work home working remote working home wfh company job	Professional area of life / job
34	normal back normal back return new normal year 2021 things go back get	Spread of the virus
35	polio polio vaccine vaccine salk children 1955 paralyzed people vaccines paralysis	Global health and public health response efforts
36	left conservative right liberal political wing side conservatives politics right wing	Government policies and decision-making processes
37	news media newsmax fox propaganda fox news watch cnn sources truth	Social issues and consequences
38	conspiracy theories conspiracy theories theory conspiracy theory conspiracy theorist theorist conspiracies moon believe	Anti-vax sentiment and conspiracy theories
39	curve wave second wave flatten flatten curve second flattening flattened flattening curve hospitals	Spread of the virus
40	car driving drive cars drunk road accidents safety drivers traffic	Public health measures and restrictions
41	christmas thanksgiving family year holidays santa parents holiday see covid	Personal area of life and leisure
42	ellie joel abby michael dwight fireflies game meredith marlene firefly	Personal area of life and leisure
43	autism autistic cause autism vaccines vaccines cause cause child wakefield mmr license	Anti-vax sentiment and conspiracy theories
44	weight fat obese pounds overweight diet lose weight healthy eating lbs	Personal area of life and leisure
45	arm news armenpress armenia azerbaijan armenpress arm arm shushi armenian artsakh azeri	Government policies and decision-making processes
46	monkeys macaques rhesus animals oxford vaccinated rhesus macaques virus viral sars cov	Vaccine development and distribution
47	ivermectin borody patients study drug 19 covid 19 scabies therapy treatment	Spread of the virus
48	reopening reopen open opening states georgia new cases reopened opened	Public health measures and restrictions
49	freezers storage dry ice pfizer cold ultra cold ice ultra freezer dry	Vaccine development and distribution
50	tb bcg bcg vaccine tuberculosis tb vaccine bcg vaccination vaccine countries vaccination 19	Global health and public health response efforts
51	mink denmark minks farms mink farms mutated danish farm humans mutation	enviromental consequences
52	smoking smokers smoke smoked smoker quit cigarettes nicotine cigarette vape	Personal area of life and leisure
53	concert album tour band concerts music tickets live year see	Personal area of life and leisure
54	needles needle fainted blood faint shot shots get getting vasovagal	Vaccine development and distribution
55	tip tipping tips takeout tipped service food restaurant server orders	Personal area of life and leisure
56	trans gender gay women male rowling female men woman transphobic	social issues and consequences
57	cruise ship cruises cruising passengers ships san diego diego cruise ship san	Spread of the virus
58	contact tracing contact tracing tracers contacts contact tracers health testing close contacts cases	Public health measures and restrictions
59	bright rick bright rick hhs bowen development authority advanced research biomedical advanced whistleblower barda	Government policies and decision-making processes
60	www reddit reddit 2famitheasshole 2fr 2famitheasshole reddit amitheasshole wiki_post_deletion wiki faq compose 2fr faq wiki_post_deletion 2fr	Personal area of life and leisure
61	ship princess diamond princess diamond cruise passengers cruise ship princess cruise infected crew	Spread of the virus
62	coming china coming person coming going fine totally control control one china control 22 totally much shut	Government policies and decision-making processes
63	book books read reading novel fiction author chapters love story	personal area of life and leisure
64	narcolepsy pandemrix swine swine flu vaccine flu flu vaccine h1n1 people sweden	Vaccine development and distribution
65	airline airlines emirates dubai flights travel copeland air westjet said	professional area of life / job
66	translate action performed bot action performed automatically translation translate automatic translation translate sl sl auto auto tl tl en	None
67	microchips microchip covid vaccine covid chip vaccine track chips 19 track us	Anti-vax sentiment and conspiracy theories
68	inovio ino 4800 inovio pharmaceuticals ino 4800 dna vaccine pharmaceuticals company phase	Vaccine development and distribution
69	hair cut haircut beard cut hair salon curly hair cut shave like	Personal area of life and leisure
70	ventilators ventilator people ventilators patients people person hospitals die put treatment	Healthcare and hospital systems capacity